{
  "schema_version": "doe_contract_v1",
  "request_hash": "4da505a60002fb83d78e05b61bb58afb859552b0300a11527edb853594eb3838",
  "revision": 1,
  "question": "Estimate the prespecified high-minus-low effect on a synthetic response",
  "family": "factorial_2x2",
  "factors": [
    {
      "name": "A",
      "levels": [
        "control",
        "candidate"
      ]
    },
    {
      "name": "B",
      "levels": [
        "low",
        "high"
      ]
    }
  ],
  "response": {
    "name": "synthetic_error",
    "unit": "declared_units",
    "direction": "lower"
  },
  "experimental_unit": {
    "definition": "One separately allocated synthetic treatment application",
    "independence_basis": "Declared independent units and independent Gaussian residuals; not established by table structure",
    "measurement_repeats": 1
  },
  "blocks": [
    "b1",
    "b2",
    "b3",
    "b4",
    "b5",
    "b6"
  ],
  "replicates": 2,
  "assumptions": [
    "normal_iid_errors",
    "constant_error_variance",
    "no_treatment_block_interaction"
  ],
  "randomization": {
    "seed": 73,
    "algorithm": "shuffle_v1"
  },
  "analysis": {
    "model": "blocked_full_factorial",
    "primary_term": "A",
    "alpha": 0.05,
    "minimum_effect": 1.3,
    "sigma": 1.3,
    "target_power": 0.8,
    "multiplicity": "single_primary",
    "missing_policy": "stop_and_review",
    "decision_rule": "two_sided_t_ci_practical_relevance_separate"
  },
  "resources": {
    "per_run": 1.0,
    "budget": 100.0
  },
  "provenance": [
    {
      "path": "/question",
      "evidence_id": "e00"
    },
    {
      "path": "/factors",
      "evidence_id": "e01"
    },
    {
      "path": "/response",
      "evidence_id": "e02"
    },
    {
      "path": "/experimental_unit",
      "evidence_id": "e03"
    },
    {
      "path": "/blocks",
      "evidence_id": "e04"
    },
    {
      "path": "/assumptions",
      "evidence_id": "e05"
    },
    {
      "path": "/analysis",
      "evidence_id": "e06"
    },
    {
      "path": "/resources",
      "evidence_id": "e07"
    }
  ],
  "run_plan": [
    {
      "run": 1,
      "unit_id": "planned_b1_u2",
      "block": "b1",
      "levels": [
        "candidate",
        "high"
      ]
    },
    {
      "run": 2,
      "unit_id": "planned_b1_u7",
      "block": "b1",
      "levels": [
        "candidate",
        "low"
      ]
    },
    {
      "run": 3,
      "unit_id": "planned_b1_u3",
      "block": "b1",
      "levels": [
        "control",
        "high"
      ]
    },
    {
      "run": 4,
      "unit_id": "planned_b1_u1",
      "block": "b1",
      "levels": [
        "candidate",
        "high"
      ]
    },
    {
      "run": 5,
      "unit_id": "planned_b1_u6",
      "block": "b1",
      "levels": [
        "control",
        "low"
      ]
    },
    {
      "run": 6,
      "unit_id": "planned_b1_u8",
      "block": "b1",
      "levels": [
        "control",
        "high"
      ]
    },
    {
      "run": 7,
      "unit_id": "planned_b1_u5",
      "block": "b1",
      "levels": [
        "control",
        "low"
      ]
    },
    {
      "run": 8,
      "unit_id": "planned_b1_u4",
      "block": "b1",
      "levels": [
        "candidate",
        "low"
      ]
    },
    {
      "run": 9,
      "unit_id": "planned_b2_u3",
      "block": "b2",
      "levels": [
        "control",
        "low"
      ]
    },
    {
      "run": 10,
      "unit_id": "planned_b2_u6",
      "block": "b2",
      "levels": [
        "control",
        "high"
      ]
    },
    {
      "run": 11,
      "unit_id": "planned_b2_u1",
      "block": "b2",
      "levels": [
        "candidate",
        "low"
      ]
    },
    {
      "run": 12,
      "unit_id": "planned_b2_u4",
      "block": "b2",
      "levels": [
        "candidate",
        "low"
      ]
    },
    {
      "run": 13,
      "unit_id": "planned_b2_u5",
      "block": "b2",
      "levels": [
        "control",
        "high"
      ]
    },
    {
      "run": 14,
      "unit_id": "planned_b2_u2",
      "block": "b2",
      "levels": [
        "candidate",
        "high"
      ]
    },
    {
      "run": 15,
      "unit_id": "planned_b2_u8",
      "block": "b2",
      "levels": [
        "candidate",
        "high"
      ]
    },
    {
      "run": 16,
      "unit_id": "planned_b2_u7",
      "block": "b2",
      "levels": [
        "control",
        "low"
      ]
    },
    {
      "run": 17,
      "unit_id": "planned_b3_u6",
      "block": "b3",
      "levels": [
        "control",
        "high"
      ]
    },
    {
      "run": 18,
      "unit_id": "planned_b3_u5",
      "block": "b3",
      "levels": [
        "candidate",
        "low"
      ]
    },
    {
      "run": 19,
      "unit_id": "planned_b3_u4",
      "block": "b3",
      "levels": [
        "candidate",
        "high"
      ]
    },
    {
      "run": 20,
      "unit_id": "planned_b3_u3",
      "block": "b3",
      "levels": [
        "candidate",
        "low"
      ]
    },
    {
      "run": 21,
      "unit_id": "planned_b3_u1",
      "block": "b3",
      "levels": [
        "control",
        "high"
      ]
    },
    {
      "run": 22,
      "unit_id": "planned_b3_u8",
      "block": "b3",
      "levels": [
        "candidate",
        "high"
      ]
    },
    {
      "run": 23,
      "unit_id": "planned_b3_u2",
      "block": "b3",
      "levels": [
        "control",
        "low"
      ]
    },
    {
      "run": 24,
      "unit_id": "planned_b3_u7",
      "block": "b3",
      "levels": [
        "control",
        "low"
      ]
    },
    {
      "run": 25,
      "unit_id": "planned_b4_u5",
      "block": "b4",
      "levels": [
        "candidate",
        "high"
      ]
    },
    {
      "run": 26,
      "unit_id": "planned_b4_u3",
      "block": "b4",
      "levels": [
        "control",
        "high"
      ]
    },
    {
      "run": 27,
      "unit_id": "planned_b4_u8",
      "block": "b4",
      "levels": [
        "control",
        "high"
      ]
    },
    {
      "run": 28,
      "unit_id": "planned_b4_u7",
      "block": "b4",
      "levels": [
        "candidate",
        "low"
      ]
    },
    {
      "run": 29,
      "unit_id": "planned_b4_u6",
      "block": "b4",
      "levels": [
        "candidate",
        "high"
      ]
    },
    {
      "run": 30,
      "unit_id": "planned_b4_u4",
      "block": "b4",
      "levels": [
        "control",
        "low"
      ]
    },
    {
      "run": 31,
      "unit_id": "planned_b4_u2",
      "block": "b4",
      "levels": [
        "candidate",
        "low"
      ]
    },
    {
      "run": 32,
      "unit_id": "planned_b4_u1",
      "block": "b4",
      "levels": [
        "control",
        "low"
      ]
    },
    {
      "run": 33,
      "unit_id": "planned_b5_u4",
      "block": "b5",
      "levels": [
        "candidate",
        "low"
      ]
    },
    {
      "run": 34,
      "unit_id": "planned_b5_u7",
      "block": "b5",
      "levels": [
        "control",
        "low"
      ]
    },
    {
      "run": 35,
      "unit_id": "planned_b5_u5",
      "block": "b5",
      "levels": [
        "control",
        "high"
      ]
    },
    {
      "run": 36,
      "unit_id": "planned_b5_u1",
      "block": "b5",
      "levels": [
        "control",
        "low"
      ]
    },
    {
      "run": 37,
      "unit_id": "planned_b5_u2",
      "block": "b5",
      "levels": [
        "candidate",
        "high"
      ]
    },
    {
      "run": 38,
      "unit_id": "planned_b5_u8",
      "block": "b5",
      "levels": [
        "candidate",
        "high"
      ]
    },
    {
      "run": 39,
      "unit_id": "planned_b5_u6",
      "block": "b5",
      "levels": [
        "control",
        "high"
      ]
    },
    {
      "run": 40,
      "unit_id": "planned_b5_u3",
      "block": "b5",
      "levels": [
        "candidate",
        "low"
      ]
    },
    {
      "run": 41,
      "unit_id": "planned_b6_u3",
      "block": "b6",
      "levels": [
        "control",
        "high"
      ]
    },
    {
      "run": 42,
      "unit_id": "planned_b6_u4",
      "block": "b6",
      "levels": [
        "control",
        "high"
      ]
    },
    {
      "run": 43,
      "unit_id": "planned_b6_u8",
      "block": "b6",
      "levels": [
        "candidate",
        "low"
      ]
    },
    {
      "run": 44,
      "unit_id": "planned_b6_u2",
      "block": "b6",
      "levels": [
        "control",
        "low"
      ]
    },
    {
      "run": 45,
      "unit_id": "planned_b6_u1",
      "block": "b6",
      "levels": [
        "candidate",
        "low"
      ]
    },
    {
      "run": 46,
      "unit_id": "planned_b6_u7",
      "block": "b6",
      "levels": [
        "candidate",
        "high"
      ]
    },
    {
      "run": 47,
      "unit_id": "planned_b6_u5",
      "block": "b6",
      "levels": [
        "control",
        "low"
      ]
    },
    {
      "run": 48,
      "unit_id": "planned_b6_u6",
      "block": "b6",
      "levels": [
        "candidate",
        "high"
      ]
    }
  ]
}
